{
  "规范版本": "1.0",
  "报告信息": {
    "报告标题": "星驰与远航拖车牵引装置品牌证据复核底稿",
    "调查日期": "2026-08-27",
    "生成时间": "2026-08-27T10:00:00+08:00",
    "底稿编号": "BMER-20260827-002"
  },
  "输入材料": [
    {
      "来源编号": "SRC-001",
      "来源类型": "客户请求文本",
      "文件名或URL": "目标品牌与商品链接清单.txt",
      "客户提供": true,
      "内容摘要": "客户提供星驰和远航品牌的代表性 Amazon 商品链接，要求核实两品牌关联主体。"
    }
  ],
  "调查范围": {
    "产品原始名称": "2 英寸拖车配重牵引装置",
    "产品规范名称": "拖车配重牵引装置",
    "产品描述": "用于拖车连接的配重牵引组件，客户提供的商品页面分别标示星驰和远航品牌。",
    "代表性商品": [
      {
        "商品ID": "PRD-001",
        "平台": "Amazon",
        "原始URL": "https://www.amazon.com/dp/B0C7STARRY",
        "平台标识符": "B0C7STARRY",
        "型号": "WDH-2-6000",
        "SKU": null,
        "证据引用": []
      },
      {
        "商品ID": "PRD-002",
        "平台": "Amazon",
        "原始URL": "https://www.amazon.com/dp/B0C7VOYAGE",
        "平台标识符": "B0C7VOYAGE",
        "型号": "WDH-2-8000",
        "SKU": null,
        "证据引用": []
      }
    ],
    "目标品牌": [
      {
        "品牌ID": "BRD-001",
        "原始名称": "星驰",
        "规范名称": "星驰（STARRY）",
        "证据引用": ["EVD-001"]
      },
      {
        "品牌ID": "BRD-002",
        "原始名称": "远航",
        "规范名称": "远航（VOYAGE）",
        "证据引用": ["EVD-002"]
      }
    ]
  },
  "证据链方法": [
    {
      "步骤编号": "步骤一",
      "名称": "核对商标登记主体",
      "执行方法": "在商标登记公开信息中核对两个品牌的申请人和权利状态。",
      "证据优先级": ["官方登记", "官方企业资料"]
    }
  ],
  "品牌复核结果": [
    {
      "品牌": {
        "原始名称": "星驰",
        "规范名称": "星驰（STARRY）"
      },
      "实际查询路径": [
        "核对商标登记公开信息中的星驰（STARRY）申请人。",
        "比对申请人公开企业资料中的规范名称。"
      ],
      "查询结果摘要": "公开商标登记信息将星驰（STARRY）关联至杭州星驰汽车用品有限公司；现有材料不足以确认具体 SKU 的实际制造商。",
      "主体关系": {
        "商标权利人": [
          {
            "主体ID": "ENT-001",
            "结论状态": "已确认",
            "可靠性等级": "中",
            "证据引用": ["EVD-001"],
            "适用限制": ["结论限于本次核对的商标登记公开信息。"]
          }
        ],
        "品牌运营主体": [],
        "母公司": [],
        "收购与历史关系": []
      },
      "制造关系": {
        "品牌层面主要制造商": [],
        "具体SKU制造商": [],
        "制造模式": "未知",
        "SKU适用限制": ["未取得产品标签、包装或说明书，不能确认 PRD-001 的实际制造商。"]
      },
      "结论评价": {
        "可靠性等级": "中",
        "可靠性依据": "商标登记公开信息支持权利人关联，但未形成制造责任的直接证据。",
        "人工复核建议": "补充产品标签或说明书后，再核查具体 SKU 的制造主体。"
      },
      "关键说明": [
        "商标权利人与制造商属于不同角色，现有证据不得推定其为同一主体。"
      ],
      "主要来源": [
        {
          "证据编号": "EVD-001",
          "来源名称": "国家知识产权局商标网上查询公开信息",
          "URL": "https://sbj.cnipa.gov.cn/",
          "来源类别": "商标登记公开信息",
          "访问日期": "2026-08-27",
          "支持结论": ["星驰（STARRY）的商标登记申请人显示为杭州星驰汽车用品有限公司。"],
          "证据等级": "官方登记"
        }
      ]
    },
    {
      "品牌": {
        "原始名称": "远航",
        "规范名称": "远航（VOYAGE）"
      },
      "实际查询路径": [
        "核对远航（VOYAGE）品牌官网页脚的运营主体说明。",
        "比对官网主体名称与星驰品牌的已识别主体。"
      ],
      "查询结果摘要": "品牌官网公开资料显示远航（VOYAGE）的运营主体为杭州星驰汽车用品有限公司；现有材料不足以确认具体 SKU 的实际制造商。",
      "主体关系": {
        "商标权利人": [],
        "品牌运营主体": [
          {
            "主体ID": "ENT-001",
            "结论状态": "已确认",
            "可靠性等级": "中",
            "证据引用": ["EVD-002"],
            "适用限制": ["结论基于品牌官网公开的运营主体说明。"]
          }
        ],
        "母公司": [],
        "收购与历史关系": []
      },
      "制造关系": {
        "品牌层面主要制造商": [],
        "具体SKU制造商": [],
        "制造模式": "未知",
        "SKU适用限制": ["未取得产品标签、包装或说明书，不能确认 PRD-002 的实际制造商。"]
      },
      "结论评价": {
        "可靠性等级": "中",
        "可靠性依据": "品牌官网公开资料支持运营主体关联，但未形成制造责任的直接证据。",
        "人工复核建议": "补充产品标签或说明书后，再核查具体 SKU 的制造主体。"
      },
      "关键说明": [
        "品牌运营主体与商标权利人、制造商属于不同角色，应分别保留证据。"
      ],
      "主要来源": [
        {
          "证据编号": "EVD-002",
          "来源名称": "远航（VOYAGE）品牌官网公开资料",
          "URL": "https://www.voyage-tow.example.cn/",
          "来源类别": "官方企业资料",
          "访问日期": "2026-08-27",
          "支持结论": ["远航（VOYAGE）品牌官网页脚列示杭州星驰汽车用品有限公司为运营主体。"],
          "证据等级": "官方企业资料"
        }
      ]
    }
  ],
  "主体索引": [
    {
      "主体ID": "ENT-001",
      "规范名称": "杭州星驰汽车用品有限公司",
      "名称变体": ["杭州星驰汽配有限公司"],
      "主体类型": "公司",
      "司法辖区": "中国浙江省杭州市",
      "注册标识": [],
      "官方网站": [null],
      "关联品牌": ["BRD-001", "BRD-002"],
      "主体角色": ["商标权利人", "品牌运营主体"],
      "当前状态": "当前",
      "结论状态": "已确认",
      "可靠性等级": "中",
      "证据引用": ["EVD-001", "EVD-002"],
      "适用限制": ["尚未取得同时支持注册标识与目标主体匹配的材料。", "尚未取得具体 SKU 的制造证据。"]
    }
  ],
  "主体关系": [
    {
      "关系ID": "REL-001",
      "起点类型": "品牌",
      "起点ID": "BRD-001",
      "关系类型": "商标权利人",
      "终点类型": "主体",
      "终点ID": "ENT-001",
      "时间状态": "当前",
      "适用层级": "品牌级",
      "适用商品ID": [],
      "结论状态": "已确认",
      "可靠性等级": "中",
      "证据引用": ["EVD-001"],
      "适用限制": ["结论限于本次核对的商标登记公开信息。"]
    },
    {
      "关系ID": "REL-002",
      "起点类型": "品牌",
      "起点ID": "BRD-002",
      "关系类型": "品牌运营主体",
      "终点类型": "主体",
      "终点ID": "ENT-001",
      "时间状态": "当前",
      "适用层级": "品牌级",
      "适用商品ID": [],
      "结论状态": "已确认",
      "可靠性等级": "中",
      "证据引用": ["EVD-002"],
      "适用限制": ["结论基于品牌官网公开的运营主体说明。"]
    }
  ],
  "总体复核分级": [
    {
      "复核等级": "中",
      "品牌": ["BRD-001", "BRD-002"],
      "适用结论": "两品牌均已形成主体关联证据，具体 SKU 制造商仍为证据不足。"
    }
  ],
  "数据库访问记录": [
    {
      "数据库": "国家知识产权局商标网上查询",
      "官方入口": "https://sbj.cnipa.gov.cn/",
      "访问时间": "2026-08-27T09:10:00+08:00",
      "访问结果": "取得与星驰（STARRY）相关的商标登记公开信息。",
      "使用建议": "将登记信息与产品标签、企业资料交叉核验。"
    },
    {
      "数据库": "远航（VOYAGE）品牌官网",
      "官方入口": "https://www.voyage-tow.example.cn/",
      "访问时间": "2026-08-27T09:40:00+08:00",
      "访问结果": "取得官网公开的品牌运营主体说明。",
      "使用建议": "保留网页存档并补充具体 SKU 的产品文件。"
    }
  ],
  "使用限制与建议": [
    "本底稿仅记录截至调查日期已取得的证据，不以电商页面单独确认制造商。",
    "共享主体只在主体索引中保留一次，品牌适用范围通过主体关系记录。"
  ],
  "用户确认": {
    "是否确认": false,
    "确认时间": null,
    "用户确认原文": null,
    "内容摘要哈希": null
  }
}
